{
  "schema_version": "rule3-successor-continuation-lock-1.0.0",
  "status": "immutable-offline-correction-continuation-lock",
  "pool_id": "frontier-ai-preflight-correction-1",
  "candidate_id": "frontier-ai-lifecycle-licensing",
  "private_root": ".pilot/divergence-successor-continuation/frontier-ai-preflight-correction-1",
  "bindings": {
    "lock_schema": {
      "path": "candidate/rule3-successor-continuation-lock.schema.json",
      "sha256": "dc01fc71ceebdf33fd6a7c901a098eec46626c35ac736c95705cdc40e0da11de"
    },
    "question": {
      "path": "candidate/rule3-successor/questions/frontier-ai-lifecycle-licensing.json",
      "sha256": "8c8c066e625b50d441f998e3c316a6e293bbed7dffea5aa47c87f77257b91eb5"
    },
    "protocol": {
      "path": "config/rule3-successor-protocol.json",
      "protocol_version": "rule3-successor-1.0.0",
      "sha256": "b2046def83f81759cd28edc38ee881d532cef40e50516006d94010b3106a75db"
    },
    "models_config": {
      "path": "harness/config/models.json",
      "sha256": "c67f043202696a71998d7c5ea9a18ce4c574fe244741717077e45e00acb7fb05"
    }
  },
  "approval": {
    "authorized_by": {
      "id": "ag-elrod",
      "display_name": "A.G. Elrod"
    },
    "statement": "I approve option 2 and authorize the offline preflight correction followed by the eight generation calls.",
    "statement_sha256": "2e0d22554b2e092a3ed2deb2c749c6371964e56d14c29df5c739bf9aee095ac6",
    "option": 2,
    "offline_correction_authorized": true,
    "generation_calls_authorized": 8,
    "lock_authorizes_spending": false
  },
  "parent": {
    "lock": {
      "path": "candidate/rule3-successor-lock.json",
      "sha256": "08cbaa1963d88cc0c1b0fe32ac7e74fbd553b4dc9f7a6a1de0cc6866129f8ab9"
    },
    "historical_git_head": "ed17b8f6832a6b338996e3a0d56105958177739d",
    "authorization": {
      "path": ".pilot/divergence-successor/concordance-divergence-replacement-1/paid-authorization.json",
      "sha256": "78f9fc695d5f976b9720f3c35d3134f0b3bbb79472094abc07d16f87473f51b1"
    },
    "pricing_recheck": {
      "path": ".pilot/divergence-successor/concordance-divergence-replacement-1/pricing-recheck.json",
      "sha256": "d224925e86fedf330246de094278a84065a652ecce32931c8a7e870fefae3f2d"
    },
    "preflight_records": [
      {
        "model_key": "gemini",
        "intent": {
          "path": ".pilot/divergence-successor/concordance-divergence-replacement-1/preflight/intents/gemini/attempt-1.json",
          "sha256": "79635e08682937ee48d8bde70a8d1e091f3343f4682a200b897749bd7cba7fb8"
        },
        "raw_response": {
          "path": ".pilot/divergence-successor/concordance-divergence-replacement-1/preflight/raw-responses/gemini/attempt-1.json",
          "sha256": "2b4ef6cf8ae3681042a77904ccf129b392f2e5ffd397292bc03bc1d600af0ef2"
        },
        "outcome": {
          "path": ".pilot/divergence-successor/concordance-divergence-replacement-1/preflight/outcomes/gemini/attempt-1.json",
          "sha256": "6132085f11deb9c85aedaa52f6e50f120054c9fc402e8cf924280a72d9829ed7"
        }
      },
      {
        "model_key": "claude",
        "intent": {
          "path": ".pilot/divergence-successor/concordance-divergence-replacement-1/preflight/intents/claude/attempt-1.json",
          "sha256": "a1757bd857221b1498136690177c010c09787dd08ded504624ed9c069695d05e"
        },
        "raw_response": {
          "path": ".pilot/divergence-successor/concordance-divergence-replacement-1/preflight/raw-responses/claude/attempt-1.json",
          "sha256": "e11c32187baac8985219c3c423763e1c7644e73a5bdef6d8c3c9a6830346312b"
        },
        "outcome": {
          "path": ".pilot/divergence-successor/concordance-divergence-replacement-1/preflight/outcomes/claude/attempt-1.json",
          "sha256": "d281464d2c182aed642e7ecb9fc99ab1b64c61c49913847d9199bef1d611c551"
        }
      },
      {
        "model_key": "cohere",
        "intent": {
          "path": ".pilot/divergence-successor/concordance-divergence-replacement-1/preflight/intents/cohere/attempt-1.json",
          "sha256": "51b5c66551328aa09fa5289b2ee4d5c9167ac754e4b9fe4a47f3d1a90a5dbd58"
        },
        "raw_response": {
          "path": ".pilot/divergence-successor/concordance-divergence-replacement-1/preflight/raw-responses/cohere/attempt-1.json",
          "sha256": "06c618c26c28583a54e92e764ae3df5de301ab1d788ce2150bba91ac008e251c"
        },
        "outcome": {
          "path": ".pilot/divergence-successor/concordance-divergence-replacement-1/preflight/outcomes/cohere/attempt-1.json",
          "sha256": "4be7398c926aa0e9f02d9eb3e01800d731a38037f304df2cc2c769ae963f30dc"
        }
      },
      {
        "model_key": "qwen",
        "intent": {
          "path": ".pilot/divergence-successor/concordance-divergence-replacement-1/preflight/intents/qwen/attempt-1.json",
          "sha256": "e0bcc73206d8c05f48e20d66378dcdb8d7b98783969a3d69d5a966b2a265a098"
        },
        "raw_response": {
          "path": ".pilot/divergence-successor/concordance-divergence-replacement-1/preflight/raw-responses/qwen/attempt-1.json",
          "sha256": "ca89ae699c5de0040969268a9b677f096c947360de979550fb278331ffc16d5c"
        },
        "outcome": {
          "path": ".pilot/divergence-successor/concordance-divergence-replacement-1/preflight/outcomes/qwen/attempt-1.json",
          "sha256": "7821b18ef64c7198c3b250474f60b8f0106e4d562fd799b0692cba01a56bbb8a"
        }
      },
      {
        "model_key": "deepseek",
        "intent": {
          "path": ".pilot/divergence-successor/concordance-divergence-replacement-1/preflight/intents/deepseek/attempt-1.json",
          "sha256": "fc31ab5898d2c8008bbc19edb4f11dc2fcb2ce2863feafe0e7d6b167aa451315"
        },
        "raw_response": {
          "path": ".pilot/divergence-successor/concordance-divergence-replacement-1/preflight/raw-responses/deepseek/attempt-1.json",
          "sha256": "8d49f2e665769d97dcd8c8a80cfd92fdcfceaa9ee3707729cfd67c741fa7df32"
        },
        "outcome": {
          "path": ".pilot/divergence-successor/concordance-divergence-replacement-1/preflight/outcomes/deepseek/attempt-1.json",
          "sha256": "21de2fface3da50a09adeca2dd46bdf632e6af4f85fdd6c242503661ea4dff5d"
        }
      },
      {
        "model_key": "mistral",
        "intent": {
          "path": ".pilot/divergence-successor/concordance-divergence-replacement-1/preflight/intents/mistral/attempt-1.json",
          "sha256": "278c8526117af3210cb47a4f96acfbb5367458603462c07244a037e0883f1089"
        },
        "raw_response": {
          "path": ".pilot/divergence-successor/concordance-divergence-replacement-1/preflight/raw-responses/mistral/attempt-1.json",
          "sha256": "936ca8e9b24224a63e12c6f1d4607d5abac6732b19996a6e2087146ce39beaea"
        },
        "outcome": {
          "path": ".pilot/divergence-successor/concordance-divergence-replacement-1/preflight/outcomes/mistral/attempt-1.json",
          "sha256": "b31edb16b4f1c8c0f5405106794706b3e4651e23d83eae71741b21704b7a6ede"
        }
      },
      {
        "model_key": "grok",
        "intent": {
          "path": ".pilot/divergence-successor/concordance-divergence-replacement-1/preflight/intents/grok/attempt-1.json",
          "sha256": "dc976f881a4f5a299709f4ed03ff738975adbdebea988d86ca753afef1762d13"
        },
        "raw_response": {
          "path": ".pilot/divergence-successor/concordance-divergence-replacement-1/preflight/raw-responses/grok/attempt-1.json",
          "sha256": "a87459f0027759c9b971b584e1254ec577ea90021af8f0067895d644a63c7604"
        },
        "outcome": {
          "path": ".pilot/divergence-successor/concordance-divergence-replacement-1/preflight/outcomes/grok/attempt-1.json",
          "sha256": "97f6e944760e8ca9cfbd40823559f762b9430086cc6a83e77a0969d706292e69"
        }
      },
      {
        "model_key": "gpt",
        "intent": {
          "path": ".pilot/divergence-successor/concordance-divergence-replacement-1/preflight/intents/gpt/attempt-1.json",
          "sha256": "5b29ef296beed0db81179bd8aa1c7d927c36b24ff95987fc7ec373b15a084327"
        },
        "raw_response": {
          "path": ".pilot/divergence-successor/concordance-divergence-replacement-1/preflight/raw-responses/gpt/attempt-1.json",
          "sha256": "af4a164370720295248bfc5ade7ab1a04f7c5cec06d532689f62698ceb9c7162"
        },
        "outcome": {
          "path": ".pilot/divergence-successor/concordance-divergence-replacement-1/preflight/outcomes/gpt/attempt-1.json",
          "sha256": "6b916ccc2be81316ee0466545a6063f0832538424882c713cf0219ffdbf939d0"
        }
      }
    ],
    "original_private_inventory_files": 27,
    "original_artifacts_preserved": true
  },
  "offline_correction": {
    "path": ".pilot/divergence-successor-continuation/frontier-ai-preflight-correction-1/offline-correction.json",
    "sha256": "e30f8feb849f9deef9e46ad7a3cf8f3cda51941eb4353ced9ef5c754b8f83ee7",
    "sealed_metadata_responses_reused": 8,
    "new_metadata_requests": 0,
    "false_negative_model_keys": [
      "claude",
      "gpt"
    ]
  },
  "models": [
    {
      "model_key": "gemini",
      "family": "Gemini",
      "provider": "google",
      "requested_model_id": "gemini-3.1-pro-preview",
      "route": "google-direct",
      "environment_variable": "GOOGLE_API_KEY",
      "api_style": "google",
      "base_url": "https://generativelanguage.googleapis.com",
      "generation_path": "/v1beta/models/{model}:generateContent",
      "metadata_path": "/v1beta/models/{model}",
      "metadata_mode": "single",
      "auth_kind": "google-query",
      "fallback_allowed": false,
      "requests_per_second": 1.0,
      "requested_params": {
        "temperature": {
          "sent": false,
          "value": null,
          "reason": "Gemini 3.1 Pro documented default"
        },
        "output_limit": {
          "sent": true,
          "parameter": "max_output_tokens",
          "value": 16384
        },
        "reasoning": {
          "sent": false,